{
  "schemaVersion": "1.0.0",
  "corpusId": "synthetic-extraction-bakeoff-v1",
  "heldOutIdentitySha256": "b95c199887b1a35bdae8558e660c0e6fddaf41b09c655d57dfd64ee29505c545",
  "candidateIdentities": {
    "geometric-baseline": {
      "providerId": "geometric-baseline",
      "modelId": "geometric-baseline-model",
      "modelVersion": "fixture-1.0.0",
      "modelDigest": "aaaaaaaaaaaaaaaaaaaaaaaaaaaaaaaaaaaaaaaaaaaaaaaaaaaaaaaaaaaaaaaa",
      "promptHash": "bbbbbbbbbbbbbbbbbbbbbbbbbbbbbbbbbbbbbbbbbbbbbbbbbbbbbbbbbbbbbbbb"
    },
    "llm-authored": {
      "providerId": "llm-authored",
      "modelId": "llm-authored-model",
      "modelVersion": "fixture-1.0.0",
      "modelDigest": "aaaaaaaaaaaaaaaaaaaaaaaaaaaaaaaaaaaaaaaaaaaaaaaaaaaaaaaaaaaaaaaa",
      "promptHash": "bbbbbbbbbbbbbbbbbbbbbbbbbbbbbbbbbbbbbbbbbbbbbbbbbbbbbbbbbbbbbbbb"
    },
    "llm-grounded": {
      "providerId": "llm-grounded",
      "modelId": "llm-grounded-model",
      "modelVersion": "fixture-1.0.0",
      "modelDigest": "aaaaaaaaaaaaaaaaaaaaaaaaaaaaaaaaaaaaaaaaaaaaaaaaaaaaaaaaaaaaaaaa",
      "promptHash": "bbbbbbbbbbbbbbbbbbbbbbbbbbbbbbbbbbbbbbbbbbbbbbbbbbbbbbbbbbbbbbbb"
    }
  },
  "heldOutScoredOnce": true,
  "arms": {
    "geometric-baseline": {
      "documents": [
        {
          "documentId": "heldout-one",
          "split": "held-out",
          "layout": "one-column",
          "status": "failed",
          "verification": {
            "status": "failed",
            "issueCodes": [
              "missing-source-run"
            ],
            "issueCount": 1
          },
          "outputHash": null,
          "byteStable": false,
          "latencyMsPerPage": 1,
          "costUsdPerPage": 0,
          "caseScores": [
            {
              "caseId": "heldout-one-sectioning",
              "documentId": "heldout-one",
              "stratum": "sectioning",
              "layout": "one-column",
              "score": 0,
              "typePrecision": 1,
              "typeRecall": 0,
              "sourceRecall": 0,
              "assetRecall": 1,
              "boilerplateContamination": 0,
              "structureHash": null,
              "verification": {
                "status": "failed",
                "issueCodes": [
                  "missing-source-run"
                ],
                "issueCount": 1
              }
            },
            {
              "caseId": "heldout-one-prose-continuity",
              "documentId": "heldout-one",
              "stratum": "prose-continuity",
              "layout": "one-column",
              "score": 0,
              "typePrecision": 1,
              "typeRecall": 0,
              "sourceRecall": 0,
              "assetRecall": 1,
              "boilerplateContamination": 0,
              "structureHash": null,
              "verification": {
                "status": "failed",
                "issueCodes": [
                  "missing-source-run"
                ],
                "issueCount": 1
              }
            },
            {
              "caseId": "heldout-one-boilerplate-exclusion",
              "documentId": "heldout-one",
              "stratum": "boilerplate-exclusion",
              "layout": "one-column",
              "score": 0,
              "typePrecision": 1,
              "typeRecall": 0,
              "sourceRecall": 0,
              "assetRecall": 1,
              "boilerplateContamination": 0,
              "structureHash": null,
              "verification": {
                "status": "failed",
                "issueCodes": [
                  "missing-source-run"
                ],
                "issueCount": 1
              }
            },
            {
              "caseId": "heldout-one-code-listings",
              "documentId": "heldout-one",
              "stratum": "code-listings",
              "layout": "one-column",
              "score": 0,
              "typePrecision": 1,
              "typeRecall": 0,
              "sourceRecall": 0,
              "assetRecall": 1,
              "boilerplateContamination": 0,
              "structureHash": null,
              "verification": {
                "status": "failed",
                "issueCodes": [
                  "missing-source-run"
                ],
                "issueCount": 1
              }
            },
            {
              "caseId": "heldout-one-tables",
              "documentId": "heldout-one",
              "stratum": "tables",
              "layout": "one-column",
              "score": 0,
              "typePrecision": 1,
              "typeRecall": 0,
              "sourceRecall": 0,
              "assetRecall": 1,
              "boilerplateContamination": 0,
              "structureHash": null,
              "verification": {
                "status": "failed",
                "issueCodes": [
                  "missing-source-run"
                ],
                "issueCount": 1
              }
            },
            {
              "caseId": "heldout-one-figures-diagrams",
              "documentId": "heldout-one",
              "stratum": "figures-diagrams",
              "layout": "one-column",
              "score": 0,
              "typePrecision": 1,
              "typeRecall": 0,
              "sourceRecall": 0,
              "assetRecall": 1,
              "boilerplateContamination": 0,
              "structureHash": null,
              "verification": {
                "status": "failed",
                "issueCodes": [
                  "missing-source-run"
                ],
                "issueCount": 1
              }
            },
            {
              "caseId": "heldout-one-equations",
              "documentId": "heldout-one",
              "stratum": "equations",
              "layout": "one-column",
              "score": 0,
              "typePrecision": 1,
              "typeRecall": 0,
              "sourceRecall": 0,
              "assetRecall": 1,
              "boilerplateContamination": 0,
              "structureHash": null,
              "verification": {
                "status": "failed",
                "issueCodes": [
                  "missing-source-run"
                ],
                "issueCount": 1
              }
            },
            {
              "caseId": "heldout-one-footnotes-citations",
              "documentId": "heldout-one",
              "stratum": "footnotes-citations",
              "layout": "one-column",
              "score": 0,
              "typePrecision": 1,
              "typeRecall": 0,
              "sourceRecall": 0,
              "assetRecall": 1,
              "boilerplateContamination": 0,
              "structureHash": null,
              "verification": {
                "status": "failed",
                "issueCodes": [
                  "missing-source-run"
                ],
                "issueCount": 1
              }
            }
          ]
        },
        {
          "documentId": "heldout-two",
          "split": "held-out",
          "layout": "two-column",
          "status": "failed",
          "verification": {
            "status": "failed",
            "issueCodes": [
              "missing-source-run"
            ],
            "issueCount": 1
          },
          "outputHash": null,
          "byteStable": false,
          "latencyMsPerPage": 1,
          "costUsdPerPage": 0,
          "caseScores": [
            {
              "caseId": "heldout-two-sectioning",
              "documentId": "heldout-two",
              "stratum": "sectioning",
              "layout": "two-column",
              "score": 0,
              "typePrecision": 1,
              "typeRecall": 0,
              "sourceRecall": 0,
              "assetRecall": 1,
              "boilerplateContamination": 0,
              "structureHash": null,
              "verification": {
                "status": "failed",
                "issueCodes": [
                  "missing-source-run"
                ],
                "issueCount": 1
              }
            },
            {
              "caseId": "heldout-two-prose-continuity",
              "documentId": "heldout-two",
              "stratum": "prose-continuity",
              "layout": "two-column",
              "score": 0,
              "typePrecision": 1,
              "typeRecall": 0,
              "sourceRecall": 0,
              "assetRecall": 1,
              "boilerplateContamination": 0,
              "structureHash": null,
              "verification": {
                "status": "failed",
                "issueCodes": [
                  "missing-source-run"
                ],
                "issueCount": 1
              }
            },
            {
              "caseId": "heldout-two-boilerplate-exclusion",
              "documentId": "heldout-two",
              "stratum": "boilerplate-exclusion",
              "layout": "two-column",
              "score": 0,
              "typePrecision": 1,
              "typeRecall": 0,
              "sourceRecall": 0,
              "assetRecall": 1,
              "boilerplateContamination": 0,
              "structureHash": null,
              "verification": {
                "status": "failed",
                "issueCodes": [
                  "missing-source-run"
                ],
                "issueCount": 1
              }
            },
            {
              "caseId": "heldout-two-code-listings",
              "documentId": "heldout-two",
              "stratum": "code-listings",
              "layout": "two-column",
              "score": 0,
              "typePrecision": 1,
              "typeRecall": 0,
              "sourceRecall": 0,
              "assetRecall": 1,
              "boilerplateContamination": 0,
              "structureHash": null,
              "verification": {
                "status": "failed",
                "issueCodes": [
                  "missing-source-run"
                ],